confession,sentiment,joy,sadness,fear,disgust,anger
"I predict/hope that as time passes and these rich kid schools like Ivies, USC, etc that use legacy admissions are going to lose prestige because they're going to be graduating rich (and mostly white) stupids with rich fathers and when that happens, UC Berkeley will reign over all.",-0.600228,0.14775,0.619806,0.136998,0.071524,0.128617
I late dropped CS61A!!!!!!!!!!!!!!!!!!!!!!!! I’m so happy!!!!!!!!!!!!!!,0.714699,0.794674,0.000104,0.011396,0.00543,0.225747
There's a really hot irish/german guy that lives in Unit 3. I see him with his soccer ball and that man makes me swoon! But he's losing his accent and that makes me sad. I'll miss you hot Unit 3 guy. You made the rough days worth it with those beautiful eyes and that accent. God I love Euro boys! Go Bears,0.494072,0.655373,0.624306,0.192856,0.094922,0.099467
"I wish Doe had designated photoshoot times. I'm currently busting my ass to try to get stuff done before deadlines and purposely came to the most serious and quiet library on campus. But every 3 minutes, girls in nice dresses come in giggling, and dudes with clicking heels don't even bother whispering. Maybe I'm the only one, but I'm seriously annoyed. I get that it's a great place for pics, but would it be unreasonable to block off a whole day or an hour a day so at least students expect it?",-0.712142,0.181098,0.228891,0.162073,0.127783,0.580641
Shoutout to the people who managed to show up for only the first and last day of discussion in my philos class (where attendance is mandatory) i appreciate ur sacrifice in lowering the curve,-0.32974,0.139944,0.781944,0.03182,0.04394,0.022115
endgame spoilers you and your gpa are going to be okay,-0.510925,0.109616,0.426389,0.43232,0.041074,0.158837
I'm a trans woman and I have a fantasy about TERFs sexually dominating me,-0.7709,0.302097,0.128615,0.099163,0.123259,0.178148
"I'm anxious. I'm coming in as an old-man transfer, into a specialized STEM field. How tf I got into Cal with a 3.5 gpa still eludes me (pers statement I think). I feel like Ive just been lucky most of my life (not coming from any wealth or privilege) and I'm not ready for the rigors that lay ahead.",-0.700458,0.516322,0.254796,0.210097,0.026598,0.043533
"There's a guy in my design innovation seminar, and wow he got mad skillz. I thought he was just bored with the professor, and was using his ipad to doodle but when I glanced over I saw him making prezi-like notes. Like for real, this guy could be a cartoonist or artist if he wanted to, everything he drew and wrote was hella aesthetic. Like wtf stop flexing bro. But real talk: just know that that random kid who sat next to you appreciates and acknowledges your artistic talent.",-0.364846,0.127886,0.455056,0.079566,0.168238,0.4387
"With all the robberies and shootings going on lately, I'd honestly be OK with an NYC style stop and frisk in Berkeley. If you have nothing to hide, you have nothing to fear.",-0.875689,0.070495,0.41438,0.23958,0.352782,0.283846
"I went to a frat party, got fucked up on alcohol, came back to the dorms, jacked off in the dorm bathrooms and got cum on my hand. When I ripped some toilet paper off, I got some cum on the last square of toilet paper. My brain brain said ""I need to wash my hands and then rip off that sheet so nobody has to touch that"", but my drunk brain said ""I need to wash my hands and then rip off that sheet, because what if a girl wipes with it and gets pregnant with my baby? Then who do I call? Jesus?"" I'm still laughing about it today tbh",-0.861022,0.007766,0.325475,0.155157,0.670471,0.203048
Sometimes when I'm proctoring exams alone and facing away from the students I'll just straight open porn on my phone.,-0.962961,0.007751,0.540766,0.201226,0.522214,0.075687
"I respect the MUSAs officers for making the math department more welcoming and hosting events (some of which I have attended), but why is it that the teaching is pretty subpar if you ask me. Example: 113 (abstract algebra) teacher doesn't use gradescope, provide any stats about tests (no idea what one's grade is), just goes over proofs in lecture without actually explaining (no math teacher I've had can explain proofs well imho), and is hard to understand/doesn't finish sentences clearly. Whenever they ask a question, no one ever responds. Yeah so I didn't do any math competitions or whatever in high school, but for some reason no math class I took I enjoyed. Don't know if part of it is that I'm not mature in math but regardless, I literally have 10x more fun reading a math textbook/notes/watching videos. Thanks Berkeley now let me just graduate and leave.",-0.283418,0.596701,0.237472,0.053417,0.062258,0.164877
"I'm failing 2 of my courses (Econ and Data). How foolish I was to think signing up for 8ams everyday of the week was ACTUALLY viable. Great. Now, I've been on Reddit for the past 2 hours, reading about stories of people who failed and I came across a comment. The comment insisted that the OP of the original Reddit post (also failing their classes, posted to seek advice) that they don't go down without a fight. Damn. It really hit home, and I'm suddenly motivated. I'm damn sure I'm on the verge of failing, but we mustn't go out like this. I have to fight to the end, win or lose. It's the only way I can cope with failing. I'm sure other people are in the same boat as I, so I encourage everyone to FIGHT, push till the end so we won't have regrets in the short-run. Cheers to all!",-0.572626,0.69401,0.562852,0.484108,0.690838,0.59151
"I just found out a few days ago that my friend got an A in 61A and an A+ in 61B and 61C. Like holy fuck you are a fucking genius but more importantly holy fuck you are absurdly humble, if I had those grades id be flyering on Sproul just to brag about them. huge respect",-0.526274,0.260885,0.094334,0.101189,0.117591,0.646193
How do your seductively offer your project partner a tissue in a way that says you’ll spread yourself open for them but also that they can depend on you to get an A? Asking for a friend,0.868031,0.639593,0.126576,0.12215,0.031343,0.098139
Anyone Crossroads insiders know where late night got their mozzarella sticks from? I still have not found comparable mozzarella sticks and I am DESPERATE.,-0.949924,0.025904,0.395656,0.331672,0.161071,0.420292
I wish I could pee outside so I don't have to waste a flush on this clear liquid coming out me,-0.892482,0.008961,0.356703,0.316171,0.548372,0.143848
"I was so depressed from this dating app, because I thought with my ideal body type, I would be able to lure dicks into my venus flytrap and immobilize me on a constant basis. I was under a dry spell for a week and it made me feel like I'm not doing enough. I make sure I clean my ass, dick, and shit before I have sex. I host and make sure the other person is comfortable, and I'm very direct with what I want. Yet, here I am, with my dry spells. I just wish I have a reliable good dick waiting for me to caress and deep-throat with lust and passion, and have it up my ass. But, people on this app are only down for now or never, and I feel like if I don't take it, I'm not gonna be able to suck his dick. They say they want FWB, but as of now, I've never fucked the same person twice.",-0.647032,0.12143,0.571566,0.153811,0.447156,0.532618
"My boyfriend and I have recently decided to share our past relationship/love interest history with each other, and I’ve been experiencing a lot of retroactive jealousy. I appreciate this transparency and feel like it’ll make our relationship stronger, but it’s also 6:51am and I haven’t slept because I just keep staring at this bikini-clad mirror selfie one of the girls posted on Twitter in 2017. My body is such a far cry from her beautiful, toned figure. Even with the magic of the right lighting and angle and pose, I know I’d never be able to look like that. I feel like he settled for me. Out of pity maybe? I’m so embarrassed that I ever felt sexy for even a moment when we’ve been intimate. Why does he pretend that he finds me attractive? *This* is what he’s been fantasizing about for the past few years. *This* is what he wants. I’m on the verge of tears; I don’t know how to shake off this awful, awful feeling.",-0.55718,0.55,0.682202,0.102247,0.119397,0.08941
"I was raised in a racist home, and now I can be just as racist as my parents. You would think that being in coastal California would help me overcome this xenophobia and other things, but nope. The only thing that really helps is my co-worker who has a racism jar for me if I say something stupid. Currently on jar 3, but this Smucker's jar has lasted longer than the two coffee cans. No complaints since November, so yay me? I better learn soon, or else I'll be out of spare change.",-0.562126,0.610283,0.544316,0.104021,0.603027,0.158091
"I'm a a straight male, and I'm completely disinterested in relationships right now. Yeah, being accepted sexually is something I aspire to one day, but I cannot fathom why most of my friends are looking forward THIS fucking much to getting a gorlfriend. I watch many straight dudes struggle to bend to their woman's every whim just so they can see nude tits. Like, we are all busy students trying to get work done, yet you still manage to force yourself to accept everything she says and does no matter how much it goes against your own convictions. I get it, we're the vegan [REDACTED] generation, but dude, have you even thought of an action plan if you wake up one day and she suddenly turns on you because of something she saw on Overheard at Berkeley? Even if someone is actively going out of their way to make my life ""better"", NO, I cannot put my values and my dreams below others' just for the female form. To be honest, going out of your way to appease me reeks of entrapment, especially given how many times people who I used to trust suddenly scapegoated me for shit I didn't do because of swirling rumors from their dance group's vice president or whoever. I wanted to get a 5th year's Masters here but I need to straight up get out of all this bullshit at Berkeley, and hearing the words ""I love you"" definitely aren't worth the stresses of potentially lying next to a sleeper cell for my social adversaries. I'm tired of being a fucking punching bag for thousands of useful idiots' feminist anger. There are literally a million better things you can do to advance social justice. Don't use Uber or Lyft on May 8 to support drivers striking for basic labor rights. Be vigilant about your paychecks if you're a student worker. I need some new experiences, most likely physically far away from those eyeing for the next opportunity to see me get stampeded. I'll refrain myself from trying to destroy them, at least for now.",-0.618824,0.499528,0.572291,0.181174,0.149806,0.596474
"First off, I just want to say sorry to Professor Dan Garcia. I shook his hand when I encountered him at the crosswalk by Soda Hall. Little did he know, I just came from taking a shit in the restroom and didn't wash my hands because I was in a rush to get to my CS lab. I'm ashamed of myself but I'm glad I got the chance to talk to him in person. He's just so nice.",-0.514769,0.03431,0.432951,0.287858,0.390843,0.216553
"Okay nothing has worked for me so I have to confess this here. About a week ago I was just playing my with my clit watching a punishteen video. It was a typical girl getting dominated thing. But just at the moment when I was about to climax the girl said ""Daddy"" very loudly for some reason, while throughout the entire video she was saying it very softly. This caught me off by surprise and the image of the actual dad popped up in my head. So for the full 10-15 seconds of my climax I had my actual father even though I looked at the screen trying to get the image away. After I climaxed , I felt really weird so I thought about it for some time. So, next time I thought I would just watch regular porn and it wouldn't happen again. But the next time I got scared even before I started watching thinking it would happen again. The anxiety took over, and I couldn't do it, my dad appearing over and over again for no reason. It was really annoying me and it kept on happening every time I tried to get some sexy alone time. I've tried multiple things like watching all kinds of porn, looking at the screen intensely to get the image away but it just doesn't happen. I don't know what to do. Does this happen normally? Does it happen with guys and their moms? I know I'm probably not going to get any help by posting here, but whatever.",-0.664996,0.420156,0.579794,0.620627,0.528967,0.461997
"I live with my friend in our tiny ass apartment that was converted from a single to a double (but we save money!). I sleep in the bottom bunk and he sleeps on the top bunk. We go out for Artichoke's all the time, play wingman at our frat's parties for each other, go to RSF together. You know, he's my bro. Whenever I wake up on M/W/F's he's always gone cause he leaves by 9:45 for his 10am on M/W/F. Usually that's when I jack off cuz I never get alone time otherwise. One day I woke up and did the same routine. I called out his name to see if he was there and got no response. I start absolutely whacking it and later I hear a voice say ""Dude, what the fuck are you--"" He looks down and sees me and I'm just *Pikachu meme*, He's just *Pikachu meme*, my dick's *pikachu meme* and the girl getting fingered by her stepsister on my phone was hella *Pikachu meme*. Turns out he was just exhausted that night, had his 10am cancelled and slept through me calling to him. I start to say ""Bro I'm sorry--"" but he goes red and says ""Let's just not talk about it."" and leaves to go hang in the apartment lobby and give me some space. Anyway, we still haven't talked since that night and it's absolutely killing me. Buddy if you're out there reading this. Let's talk things out. I need someone to go to RSF with me and Artichoke's doesn't taste as good without my bro. I'm sorry, let's fix things",-0.693598,0.547244,0.573596,0.168033,0.09264,0.161539
I could never write the “&” symbol until I took a linguistics class. Now my life is so much easier.,0.458246,0.513864,0.212007,0.129668,0.038323,0.066531
"I really wish Berkeley had a more cohesive program for visual design. Other schools have majors in UX/UI Design or HCI or Applied Arts, but all we have are some random certifications across a couple of groups like Jacobs and a few sort-of-relevant majors like Architecture or Art Practice. And yeah I get that your portfolio matters a lot more than the name of your major, but I just wish I could proudly say 'Yeah I'm a design major' instead of hesitantly saying 'Yeah I'm a uhhh CS major' and hope they pick up on the doubt in my voice so I could explain that I'm only CS because of 160 and because what else could I major in when my degree doesn't exist?",0.316241,0.071226,0.498524,0.464586,0.032207,0.146701
"Usually my boyfriend and I make time to eat lunch together between classes midday. I always look forward to it because he gives me asmr by crunching chips or apple slices in his mouth next to my ears. It relaxes me so much when I’m stressed and sends tingles and shudders down much spine and I visibly twitch. Sometimes I wonder if it’s too sensual to do in public, but we do anyway lmao",0.424651,0.566291,0.221627,0.130558,0.056815,0.134602
"I don't know why everyone hates Main Stacks. It's quiet, clean, and you can always find a place to study, plus it's super bright and nice in the daytime with all the skylights! Moffitt, however, is the true scum of the earth and where the worst of humanity collects. If you spend nights in Moffitt, or you're one of those evil club leaders that demand we have meetings in Moffitt, I'll see you in hell",-0.489735,0.291563,0.034417,0.017766,0.216086,0.605989
"I was recently admitted to Cal as a transfer student. I also recently started dating the girl of my dreams (who I've known for years). I can see myself with her for years to come, and every day I wake up feeling lucky to be with her. Despite how much I care for her, a part of me is longing for that traditional crazy college experience. I've never had a one night stand, nor have I ever really had a chance to explore my own sexuality with multiple people. I've spent my adult life putting my love life to the side and instead working to get accepted into Cal. Now that I've been accepted to Cal, I hate the thought that I'm missing out on something. I know one of the main reasons I feel like I'm missing out on something is because I've been told throughout life what I'm supposed to experience in college - parties, hook up culture, etc. and I've honestly been looking forward to all of that since high school. Would I trade in my relationship to experience any of that? Absolutely not. I know that I will be faithful to my partner. But there will always be a small part of me that wishes I were able to have that traditional college experience that I've been spoon fed since I was in high school and it drives me crazy.",-0.48211,0.566248,0.628418,0.110907,0.05832,0.138004
"As a 28 year old Asian American guy, I watched the BTS/Halsey music video multiple times. It wasn't until the 5th time, that I started crying. I realized that Asian Americans have finally made it in mainstream media. I never thought I would see something like this, even two years ago. BTS collaborating with someone as famous as Halsey was amazing. I was so happy watching the music video, watching their cute dances, that I fell in love with kpop again. I had a small kpop phase in middle school, but this brought back memories and nostalgia. Now I find myself researching a lot about BTS and trying to know the group more. I'm a typical buff Asian jock with an undercut hairstyle, but even I appreciate BTS, who look completely different than me.",0.367004,0.668111,0.602168,0.09695,0.069588,0.071876
"I'm a graduating senior who's been on that job-search grind since the fall, and I'm honestly starting to develop so much anxiety and depression over it. Back when I applied to college, I managed to get into every single UC except my top two choices, LA and Davis. I chose to come to Cal on pretty much prestige alone. ""Your UC Berkeley diploma will basically guarantee you a job after college!"" is what everyone told me. They were so wrong. During my time here I chose to major in biology, and branch out and take CS classes on the side due to my interest in AI technology. I've taken all of ""those"" classes (CS70, CS100, CS188, etc.), but no matter what I try to do I can't seem to find opportunities for someone like me. All the bio companies and labs that look for skilled software engineers only end up hiring CS majors, and all the tech companies that are looking to get into the biotech industry only look for hardcore biologists with years of wet lab experience. It seems like, in an effort to become well-rounded and better suited for the field that I want to work in, I've become the exact person that no one wants. I keep thinking ""maybe I should have taken more bio classes"" or ""maybe I should have just tried to be a CS major"" or ""maybe I should have tried to transfer into BioE.""",-0.523888,0.209912,0.671207,0.172991,0.675656,0.693405
"I love making themed playlists on Spotify. I put way too much effort and thought into them. Sometimes, I just look at my own Spotify homepage and feel proud. Secretly, I really really wish someone would tell me I did I good job with one of them. In the dead of night I just made the most flawless playlist I've ever crafted. I just wanted to tell someone cause no one cares!",0.708042,0.708304,0.238165,0.076878,0.078359,0.168688
"I copy my homework from past solutions in EE16A. I'm not proud of this, but the amount of work/time this takes along with my other commitments really take a toll. If I'm being honest, I also just procrastinate a lot and end up not having enough time at the end to do them. I recently received an email that said they caught me copying a past homework and I will receive a 0 for that class. The grade is fine – I don't really care at this point. I'm just worried they'll find my other copied homework and give me an F in this class or expel me. Has anyone else had this happen to them, or know of anyone who has had this happen? I'm really worried, and I won't copy future homework anymore, but it might be too late.",-0.78319,0.456593,0.575296,0.613015,0.067695,0.167061
"i've realized, after many many months of browsing r/awww and watching cute cat and dog videos, that i can never own a pet. if i ever have a being that will love me and provide emotional support, i would never want a boyfriend again. this is an actual dilemma",0.592086,0.791658,0.141332,0.030778,0.034088,0.020676
"People who take up space the Units music rooms to use as their personal study area are such pricks. There are people who actually need the rooms to practice music and you’re literally just wasting our time. Today some guy was literally just using one of the music rooms to video-call his friend, laptop propped on top of the piano and all. And when I asked whether he actually needed the room, the asshole told me to wait 25 minutes for him to finish his call. If this wasn’t a Sunday, I would’ve gone straight to the Unit 3 office to kick your selfish ass out.",-0.738537,0.108388,0.21529,0.083294,0.127251,0.71989
I keep a public diary of my love life on the wall of a certain cubicle in Main Stacks. I always wonder if any of my love interests have seen it or if anyone reads it at all,0.546644,0.742919,0.101457,0.055908,0.111519,0.023152
"Recently, my roommate has been such a pain in the ass. He never leaves the apartment AND has even walked in on me and my girlfriend having sex. The bad part is that even though he knows what's going on, he sits on his fucking desk doing nothing. As of late, we have just been having sex with him in the room but it's obviously not the same and takes away from the amazing sex we have when nobody's home. Fellas, if your homie is getting some punani YOU LET HIM GET PUNANI. No questions asked.",-0.796752,0.170726,0.619332,0.149236,0.534275,0.458394
"I woke up a few hours ago and had the weirdest fucking dream. Nicholas Weaver was there with his usual quirky mannerisms and my mom was there too for some reason?? The thing is, I was trash talking Weaver in my mother tongue with my mom (which is weird because I actually enjoyed his 61C and 161 right now) and then he responded back in my *mother tongue* that he understood us and to not be assholes. And then I woke up. This was especially confusing for me because now I feel weirdly sexually attracted to him? Like, the only reason why he makes my girlhood tremble is because he can speak Mandarin in my dreams. This makes absolutely no logical sense since there’s no fucking way he can speak it but now this weird man turns me on whenever I think of him speaking Mandarin.",-0.768335,0.525577,0.482298,0.177803,0.069804,0.599317
"a week and a half ago, my roommate ate my ramen. every day since then i've strategically placed drops of sriracha in his toothpaste and shampoo. today in the shower i heard him scream so loudly it rattled the walls. he ran out half naked and cried like a baby. if you read this i don't give a shit. think twice before you mess with my ramen motherfucker.",-0.977307,0.441263,0.605137,0.131055,0.213843,0.657114
"I think I’m trans. I realized it when I was with my ex - she was the first person I’d ever been with who I felt comfortable opening up to about it, and she (having only been with girls before) treated me like a girl in bed. I’m over her romantically, but remembering the way that felt gives me this warm feeling and then emptiness because I don’t know how I’ll ever feel that again. I’ve started presenting a little more feminine, but I just look like a twink. I really don’t know where to go from here.",-0.688791,0.413292,0.445769,0.126479,0.058659,0.073824
"I would like everyone to remember that, being in a relationship is a privilege. Being in a healthy, happy one of course. Many people do not have that privilege. The privilege of feeling loved. The privilege of having sex. These are things a lot of people do not have. Just like race and gender, it's important to acknowledge someones relationship status and how they struggle with it. For myself, I am an asian guy, who will graduate from this campus a virgin because no girl here is nice enough to let me kiss her or have sex with her. I am not angry, but I do think I deserve some acknowledgement as a victim of a system which only lets a small handful of people have meaningful relationships.",0.650223,0.695207,0.537836,0.066442,0.131723,0.068757
To the random chick that I kept making eye contact with in 5th floor Moffitt: You're hot but school comes first sorry,-0.672176,0.071843,0.526117,0.292835,0.086833,0.123249
So I was in a long line for food the other day and the one in front of me ran into like 5 of her friends who then proceeded to all cut me in line because they were friends and wanted to stick together. Just wanted your people's quick opinion on this. Is it bad to wish suffering upon ones bloodline in this scenario.,-0.724391,0.021114,0.762428,0.157234,0.164906,0.187486
campus wifi is so bad i cant connect my phone to wifi well enough to FUCKING LOG IN TO MY CALCENTRAL ACCOUNT CUZ OF 2 STEP VERIFICATION AHHHHHH,-0.993888,0.01588,0.58205,0.042961,0.073487,0.551189
